title,text,clean_text
YouTube backlash begins: “Why is AI combing through every single video I watch?” | Adult YouTubers defend childish viewing habits in fight to block AI age checks.,YouTube backlash begins: “Why is AI combing through every single video I watch?” | Adult YouTubers defend childish viewing habits in fight to block AI age checks. ,youtube backlash begins ai combing every single video watch adult youtubers defend childish viewing habits fight block ai age checks
The Koenigsegg Jesko Absolut Just Crushed One of the Rimac Nevera's Most Impressive Records | There's a new 0-400-0 km/h king — and it beat the outgoing champ using half as many driven wheels.,The Koenigsegg Jesko Absolut Just Crushed One of the Rimac Nevera's Most Impressive Records | There's a new 0-400-0 km/h king — and it beat the outgoing champ using half as many driven wheels. ,koenigsegg jesko absolut crushed one rimac neveras impressive records theres new kmh king beat outgoing champ using half many driven wheels
Windows 11 24H2 updates failing again with 0x80240069 errors,Windows 11 24H2 updates failing again with 0x80240069 errors ,windows h updates failing x errors
Google Finds Workaround for Lobbying Rules That Omits Big Bosses,Google Finds Workaround for Lobbying Rules That Omits Big Bosses ,google finds workaround lobbying rules omits big bosses
"After exposure to artificial intelligence, diagnostic colonoscopy polyp detection rates in four Polish medical centers decreased from 28.4% to 22.4%","After exposure to artificial intelligence, diagnostic colonoscopy polyp detection rates in four Polish medical centers decreased from 28.4% to 22.4% ",exposure artificial intelligence diagnostic colonoscopy polyp detection rates four polish medical centers decreased
"German tech firm sues Nvidia for patent infringement, seeks to block Nvidia across 18 European countries — ParTec lawsuit alleges DGX AI supercomputer design theft","German tech firm sues Nvidia for patent infringement, seeks to block Nvidia across 18 European countries — ParTec lawsuit alleges DGX AI supercomputer design theft ",german tech firm sues nvidia patent infringement seeks block nvidia across european countries partec lawsuit alleges dgx ai supercomputer design theft
Stripe Says Support Team Reps Were ‘Totally Wrong’ About LGBTQ Content Ban,Stripe Says Support Team Reps Were ‘Totally Wrong’ About LGBTQ Content Ban ,stripe says support team reps totally wrong lgbtq content ban
[CNN] 133-year old Kodak says it might have to cease operations,[CNN] 133-year old Kodak says it might have to cease operations ,cnn year old kodak says might cease operations
What If A.I. Doesn’t Get Much Better Than This?,What If A.I. Doesn’t Get Much Better Than This? ,ai doesnt get much better
First Propaganda Detection Mechanism for Telegram,First Propaganda Detection Mechanism for Telegram ,first propaganda detection mechanism telegram
AI Eroded Doctors’ Ability to Spot Cancer Within Months in Study,AI Eroded Doctors’ Ability to Spot Cancer Within Months in Study ,ai eroded doctors ability spot cancer within months study
Russian government hackers said to be behind US federal court filing system hack: Report,Russian government hackers said to be behind US federal court filing system hack: Report ,russian government hackers said behind us federal court filing system hack report
Routine AI assistance hits skills of health experts performing colonoscopies,Routine AI assistance hits skills of health experts performing colonoscopies ,routine ai assistance hits skills health experts performing colonoscopies
Google faces loss of Chrome as Perplexity bid adds drama to looming breakup decision,Google faces loss of Chrome as Perplexity bid adds drama to looming breakup decision ,google faces loss chrome perplexity bid adds drama looming breakup decision
"Ford Recalling 312,000 Trucks, SUVs with Brake Booster Issue | The issue is limited to 2025 models of the Ford F-150, Expedition, Bronco, and Ranger, along with the Lincoln Navigator.","Ford Recalling 312,000 Trucks, SUVs with Brake Booster Issue | The issue is limited to 2025 models of the Ford F-150, Expedition, Bronco, and Ranger, along with the Lincoln Navigator. ",ford recalling trucks suvs brake booster issue issue limited models ford f expedition bronco ranger along lincoln navigator
Google Gets an Astounding $34.5 Billion Offer for Chrome Browser From AI Startup Perplexity,Google Gets an Astounding $34.5 Billion Offer for Chrome Browser From AI Startup Perplexity ,google gets astounding billion offer chrome browser ai startup perplexity
Microsoft gets EU hall pass despite admitting it can't protect European data,Microsoft gets EU hall pass despite admitting it can't protect European data ,microsoft gets eu hall pass despite admitting cant protect european data
UK Government urges citizens to delete old emails and pictures as data centres require vast amounts of water to cool their systems,UK Government urges citizens to delete old emails and pictures as data centres require vast amounts of water to cool their systems ,uk government urges citizens delete old emails pictures data centres require vast amounts water cool systems
How Big Tech is paying its way out of Trump's tariffs,How Big Tech is paying its way out of Trump's tariffs ,big tech paying way trumps tariffs
"A guy in California is suing Microsoft for discontinuing Windows 10, demanding free extended support","A guy in California is suing Microsoft for discontinuing Windows 10, demanding free extended support ",guy california suing microsoft discontinuing windows demanding free extended support
The Awkward Adolescence of a Media Revolution: Truth is still alive on social media—but it’s not easy enough to find.,The Awkward Adolescence of a Media Revolution: Truth is still alive on social media—but it’s not easy enough to find. ,awkward adolescence media revolution truth still alive social mediabut easy enough find
Chinese Display Company Faces US Ban For Stealing Samsung Tech,Chinese Display Company Faces US Ban For Stealing Samsung Tech ,chinese display company faces us ban stealing samsung tech
Hackers post some St. Paul files online after city refuses to pay ransom,Hackers post some St. Paul files online after city refuses to pay ransom ,hackers post st paul files online city refuses pay ransom
Drones could soon become more intrusive than ever,Drones could soon become more intrusive than ever ,drones could soon become intrusive ever
[News] Intel Rolls Out “USAI” Web Page Showcasing Commitment to U.S. Manufacturing,[News] Intel Rolls Out “USAI” Web Page Showcasing Commitment to U.S. Manufacturing ,news intel rolls usai web page showcasing commitment us manufacturing
China’s Lead in Open-Source AI Jolts Washington and Silicon Valley,China’s Lead in Open-Source AI Jolts Washington and Silicon Valley ,chinas lead opensource ai jolts washington silicon valley
"Google's Gemini AI tells a Redditor it's 'cautiously optimistic' about fixing a coding bug, fails repeatedly, calls itself an embarrassment to 'all possible and impossible universes' before repeating 'I am a disgrace' 86 times in succession","Google's Gemini AI tells a Redditor it's 'cautiously optimistic' about fixing a coding bug, fails repeatedly, calls itself an embarrassment to 'all possible and impossible universes' before repeating 'I am a disgrace' 86 times in succession ",googles gemini ai tells redditor cautiously optimistic fixing coding bug fails repeatedly calls embarrassment possible impossible universes repeating disgrace times succession
Privacy Experts warn against YouTube’s “creepy” AI age estimation system launching in the US,Privacy Experts warn against YouTube’s “creepy” AI age estimation system launching in the US ,privacy experts warn youtubes creepy ai age estimation system launching us
UK government urges Brits to delete emails and photos to save water,UK government urges Brits to delete emails and photos to save water ,uk government urges brits delete emails photos save water
Trump FCC Installs Babysitter At CBS To Ensure The Network Kisses King Donald’s Ass,Trump FCC Installs Babysitter At CBS To Ensure The Network Kisses King Donald’s Ass ,trump fcc installs babysitter cbs ensure network kisses king donalds ass
Microsoft is getting ready to return to the office,Microsoft is getting ready to return to the office ,microsoft getting ready return office
"""97% Battery Recycling Breakthrough"": Princeton NuEnergy Opens First U.S. Commercial Facility, Cutting Costs 38% and Slashing Environmental Impact","""97% Battery Recycling Breakthrough"": Princeton NuEnergy Opens First U.S. Commercial Facility, Cutting Costs 38% and Slashing Environmental Impact ",battery recycling breakthrough princeton nuenergy opens first us commercial facility cutting costs slashing environmental impact
The Trump Administration Is Using Memes to Turn Mass Deportation Into One Big Joke,The Trump Administration Is Using Memes to Turn Mass Deportation Into One Big Joke ,trump administration using memes turn mass deportation one big joke
We caught companies making it harder to delete your personal data online – The Markup,We caught companies making it harder to delete your personal data online – The Markup ,caught companies making harder delete personal data online markup
Researchers Made a Social Media Platform Where Every User Was AI. The Bots Ended Up at War,Researchers Made a Social Media Platform Where Every User Was AI. The Bots Ended Up at War ,researchers made social media platform every user ai bots ended war
Inside Silicon Valley’s Growing Obsession With Having Smarter Babies,Inside Silicon Valley’s Growing Obsession With Having Smarter Babies ,inside silicon valleys growing obsession smarter babies
CoreWeave CFO: $25B raised in debt and equity in 18 months,CoreWeave CFO: $25B raised in debt and equity in 18 months ,coreweave cfo b raised debt equity months
"The average Waymo robotaxi completes more trips per day than 99% of Uber drivers, CEO Dara Khosrowshahi says","The average Waymo robotaxi completes more trips per day than 99% of Uber drivers, CEO Dara Khosrowshahi says ",average waymo robotaxi completes trips per day uber drivers ceo dara khosrowshahi says
Researchers asked AI to show a typical Australian dad: he was white and had an iguana,Researchers asked AI to show a typical Australian dad: he was white and had an iguana ,researchers asked ai show typical australian dad white iguana
Russia Is Suspected to Be Behind Breach of Federal Court Filing System,Russia Is Suspected to Be Behind Breach of Federal Court Filing System ,russia suspected behind breach federal court filing system
Studies warn AI chatbots could be making young people more narcissistic,Studies warn AI chatbots could be making young people more narcissistic ,studies warn ai chatbots could making young people narcissistic
"Trump's 100% chip tariffs will likely hurt smaller manufacturers, as major companies court exemptions","Trump's 100% chip tariffs will likely hurt smaller manufacturers, as major companies court exemptions ",trumps chip tariffs likely hurt smaller manufacturers major companies court exemptions
China has reasons beyond the climate to turn into the world's first electrostate,China has reasons beyond the climate to turn into the world's first electrostate ,china reasons beyond climate turn worlds first electrostate
Tesla Eyes New York City for Robotaxis With Test-Driver Job Posting,Tesla Eyes New York City for Robotaxis With Test-Driver Job Posting ,tesla eyes new york city robotaxis testdriver job posting
"Exclusive: US embeds trackers in AI chip shipments to catch diversions to China, sources say","Exclusive: US embeds trackers in AI chip shipments to catch diversions to China, sources say ",exclusive us embeds trackers ai chip shipments catch diversions china sources say
EPA Tells Truck Makers to Stop Forcing Immediate Limp Mode for Low DEF,EPA Tells Truck Makers to Stop Forcing Immediate Limp Mode for Low DEF ,epa tells truck makers stop forcing immediate limp mode low def
Microsoft asks users to ignore certificate enrollment errors,Microsoft asks users to ignore certificate enrollment errors ,microsoft asks users ignore certificate enrollment errors
iRobot’s future isn’t looking up,iRobot’s future isn’t looking up ,irobots future isnt looking
Will AI make language dubbing easy for film and TV?,Will AI make language dubbing easy for film and TV? ,ai make language dubbing easy film tv
The internet is about to get a little worse as Reddit moves to block the Internet Archive so AI companies can't scrape its content,The internet is about to get a little worse as Reddit moves to block the Internet Archive so AI companies can't scrape its content ,internet get little worse reddit moves block internet archive ai companies cant scrape content
AI Rental Scanner Unfairly Charging You With Damage? There's AI For That,AI Rental Scanner Unfairly Charging You With Damage? There's AI For That ,ai rental scanner unfairly charging damage theres ai
Feds Used Local Cop's Password to Do Immigration Surveillance With Flock Cameras,Feds Used Local Cop's Password to Do Immigration Surveillance With Flock Cameras ,feds used local cops password immigration surveillance flock cameras
Hackers breach and expose a major North Korean spying operation,Hackers breach and expose a major North Korean spying operation ,hackers breach expose major north korean spying operation
Trump administration stops illegal freeze of $5B EV charger funds after losing in court,Trump administration stops illegal freeze of $5B EV charger funds after losing in court ,trump administration stops illegal freeze b ev charger funds losing court
"China Is Taking AI Safety Seriously. So Must the U.S. | ""China doesn’t care about AI safety—so why should we?” This flawed logic pervades U.S. policy and tech circles, offering cover for a reckless race to the bottom as Washington rushes to outpace Beijing in AI development.","China Is Taking AI Safety Seriously. So Must the U.S. | ""China doesn’t care about AI safety—so why should we?” This flawed logic pervades U.S. policy and tech circles, offering cover for a reckless race to the bottom as Washington rushes to outpace Beijing in AI development. ",china taking ai safety seriously must us china doesnt care ai safetyso flawed logic pervades us policy tech circles offering cover reckless race bottom washington rushes outpace beijing ai development
Russian censorship agency confirms restrictions to calls on Telegram and WhatsApp,Russian censorship agency confirms restrictions to calls on Telegram and WhatsApp ,russian censorship agency confirms restrictions calls telegram whatsapp
"Former Intel CEO lays out radical plan to rescue the company — Suggests ousting Lip-Bu Tan and asks for $40 billion investment from Nvidia, Apple, and others","Former Intel CEO lays out radical plan to rescue the company — Suggests ousting Lip-Bu Tan and asks for $40 billion investment from Nvidia, Apple, and others ",former intel ceo lays radical plan rescue company suggests ousting lipbu tan asks billion investment nvidia apple others
Two Chinese nationals arrested in California for smuggling high end microchips to China against US sanctions.,Two Chinese nationals arrested in California for smuggling high end microchips to China against US sanctions. ,two chinese nationals arrested california smuggling high end microchips china us sanctions
Earth appears to be developing new never-before-seen human-made seasons,Earth appears to be developing new never-before-seen human-made seasons ,earth appears developing new neverbeforeseen humanmade seasons
Chiplet Technology Becomes Sandia’s Secret Weapon for AI and Quantum,Chiplet Technology Becomes Sandia’s Secret Weapon for AI and Quantum ,chiplet technology becomes sandias secret weapon ai quantum
'Most massive black hole ever discovered' is detected,'Most massive black hole ever discovered' is detected ,massive black hole ever discovered detected
"Trump screwed over Nvidia’s Chinese sales, then let them happen","Trump screwed over Nvidia’s Chinese sales, then let them happen ",trump screwed nvidias chinese sales let happen
Women with AI ‘boyfriends’ mourn lost love after ‘cold’ ChatGPT upgrade,Women with AI ‘boyfriends’ mourn lost love after ‘cold’ ChatGPT upgrade ,women ai boyfriends mourn lost love cold chatgpt upgrade
"Iron Man’s Acura NSX Roadster Was Actually a 1991 NSX With 252,000 Miles","Iron Man’s Acura NSX Roadster Was Actually a 1991 NSX With 252,000 Miles ",iron mans acura nsx roadster actually nsx miles
Are California's EV Drivers About to Lose Their Coveted Carpool Lane Privileges?,Are California's EV Drivers About to Lose Their Coveted Carpool Lane Privileges? ,californias ev drivers lose coveted carpool lane privileges
Man poisoned himself after taking medical advice from ChatGPT,Man poisoned himself after taking medical advice from ChatGPT ,man poisoned taking medical advice chatgpt
"IBM, Google claim breakthroughs in push for quantum computers are almost here after major breakthroughs: ‘It doesn’t feel like a dream anymore’","IBM, Google claim breakthroughs in push for quantum computers are almost here after major breakthroughs: ‘It doesn’t feel like a dream anymore’ ",ibm google claim breakthroughs push quantum computers almost major breakthroughs doesnt feel like dream anymore
Nest announces end of support for first and second-gen Thermostats | Smart Thermostats will no longer be smart,Nest announces end of support for first and second-gen Thermostats | Smart Thermostats will no longer be smart ,nest announces end support first secondgen thermostats smart thermostats longer smart
Trump says he's open to letting Nvidia sell a downgraded version of its most advanced chip to China,Trump says he's open to letting Nvidia sell a downgraded version of its most advanced chip to China ,trump says hes open letting nvidia sell downgraded version advanced chip china
Relying on AI in Colonoscopies May Erode Clinicians' Skills,Relying on AI in Colonoscopies May Erode Clinicians' Skills ,relying ai colonoscopies may erode clinicians skills
"Chinese scientists synthesize rare meteorite hexagonal diamonds 60% harder than cubic ones found on Earth, through previously elusive process","Chinese scientists synthesize rare meteorite hexagonal diamonds 60% harder than cubic ones found on Earth, through previously elusive process ",chinese scientists synthesize rare meteorite hexagonal diamonds harder cubic ones found earth previously elusive process
Grok claims it was briefly suspended from X after accusing Israel of genocide,Grok claims it was briefly suspended from X after accusing Israel of genocide ,grok claims briefly suspended x accusing israel genocide
"Match Group to pay FTC $14 million to end claims of scam advertisements, cumbersome cancellation process","Match Group to pay FTC $14 million to end claims of scam advertisements, cumbersome cancellation process ",match group pay ftc million end claims scam advertisements cumbersome cancellation process
"If You Try to Sell Your Cybertruck, You Are Going to Get a Terrible Surprise","If You Try to Sell Your Cybertruck, You Are Going to Get a Terrible Surprise ",try sell cybertruck going get terrible surprise
Appeals Court Allows DOGE Access to Sensitive Data at Several Agencies,Appeals Court Allows DOGE Access to Sensitive Data at Several Agencies ,appeals court allows doge access sensitive data several agencies
Revel shuts down its ride-hail business to focus on EV charging,Revel shuts down its ride-hail business to focus on EV charging ,revel shuts ridehail business focus ev charging
"Video game sales shift to older, high-income consumers as young adults cut back | Older gamers represent a larger portion of spending, while young adults focus on groceries","Video game sales shift to older, high-income consumers as young adults cut back | Older gamers represent a larger portion of spending, while young adults focus on groceries ",video game sales shift older highincome consumers young adults cut back older gamers represent larger portion spending young adults focus groceries
Roblox bans and threatens to sue “predator hunter” YouTuber Schlep,Roblox bans and threatens to sue “predator hunter” YouTuber Schlep ,roblox bans threatens sue predator hunter youtuber schlep
"Sloppy AI defenses take cybersecurity back to the 1990s, researchers say","Sloppy AI defenses take cybersecurity back to the 1990s, researchers say ",sloppy ai defenses take cybersecurity back researchers say
"Trump reverses course on Intel CEO Lip-Bu Tan following White House meeting, boosting Intel stock | Trump called Tan's success and rise ""amazing""","Trump reverses course on Intel CEO Lip-Bu Tan following White House meeting, boosting Intel stock | Trump called Tan's success and rise ""amazing"" ",trump reverses course intel ceo lipbu tan following white house meeting boosting intel stock trump called tans success rise amazing
Thousands of files on rogue California cops made public via searchable database,Thousands of files on rogue California cops made public via searchable database ,thousands files rogue california cops made public via searchable database
How language is hiding the real internet from you,How language is hiding the real internet from you ,language hiding real internet
Reddit will block the Internet Archive,Reddit will block the Internet Archive ,reddit block internet archive
"AI as a relationship advisor: ‘It gave me the right words, to the point I was moved to tears’","AI as a relationship advisor: ‘It gave me the right words, to the point I was moved to tears’ ",ai relationship advisor gave right words point moved tears
"James Cameron says ""confronting"" generative AI is the most important issue in movies right now: ""There are some very dangerous things ahead of us"" | The filmmaker describes Hollywood's current situation with AI as ""the Wild West""","James Cameron says ""confronting"" generative AI is the most important issue in movies right now: ""There are some very dangerous things ahead of us"" | The filmmaker describes Hollywood's current situation with AI as ""the Wild West"" ",james cameron says confronting generative ai important issue movies right dangerous things ahead us filmmaker describes hollywoods current situation ai wild west
Palantir CEO says working at his $430 billion software company is better than a degree from Harvard or Yale: ‘No one cares about the other stuff’,Palantir CEO says working at his $430 billion software company is better than a degree from Harvard or Yale: ‘No one cares about the other stuff’ ,palantir ceo says working billion software company better degree harvard yale one cares stuff
'Building cities on the Moon': Chinese scientists develop machine to turn lunar dust into bricks,'Building cities on the Moon': Chinese scientists develop machine to turn lunar dust into bricks ,building cities moon chinese scientists develop machine turn lunar dust bricks
"A $2,500 interceptor drone built to destroy Iranian Shaheds was recorded flying at the speed of a bullet train","A $2,500 interceptor drone built to destroy Iranian Shaheds was recorded flying at the speed of a bullet train ",interceptor drone built destroy iranian shaheds recorded flying speed bullet train
Trump Wasted No Time Derailing His Own AI Plan,Trump Wasted No Time Derailing His Own AI Plan ,trump wasted time derailing ai plan
Reddit Is Blocking the Wayback Machine From Archiving Posts | Reddit is limiting the Wayback Machine from indexing most of its site over concerns of unauthorized AI scraping.,Reddit Is Blocking the Wayback Machine From Archiving Posts | Reddit is limiting the Wayback Machine from indexing most of its site over concerns of unauthorized AI scraping. ,reddit blocking wayback machine archiving posts reddit limiting wayback machine indexing site concerns unauthorized ai scraping
"Trump flip-flops on Intel CEO, calls him 'success' days after demanding resignation","Trump flip-flops on Intel CEO, calls him 'success' days after demanding resignation ",trump flipflops intel ceo calls success days demanding resignation
The AI Takeover of Education Is Just Getting Started,The AI Takeover of Education Is Just Getting Started ,ai takeover education getting started
Crypto crasher Do Kwon admits guilt over failed not-so-stablecoin that erased $41 billion,Crypto crasher Do Kwon admits guilt over failed not-so-stablecoin that erased $41 billion ,crypto crasher kwon admits guilt failed notsostablecoin erased billion
Epic wins cases against Apple and Google in Australia,Epic wins cases against Apple and Google in Australia ,epic wins cases apple google australia
User sues Microsoft over planned end of Windows 10 support,User sues Microsoft over planned end of Windows 10 support ,user sues microsoft planned end windows support
Perplexity Makes Longshot $34.5 Billion Offer for Chrome,Perplexity Makes Longshot $34.5 Billion Offer for Chrome ,perplexity makes longshot billion offer chrome
This drug can turn your blood into mosquito poison,This drug can turn your blood into mosquito poison ,drug turn blood mosquito poison
Boston Public Library aims to increase access to a vast historic archive using AI,Boston Public Library aims to increase access to a vast historic archive using AI ,boston public library aims increase access vast historic archive using ai
"AI startup Windsurf's wild month with Google, OpenAI and Cognition","AI startup Windsurf's wild month with Google, OpenAI and Cognition ",ai startup windsurfs wild month google openai cognition
Trump just handed Apple a huge fiscal Q4 gift.,Trump just handed Apple a huge fiscal Q4 gift. ,trump handed apple huge fiscal q gift
