title,text,clean_text
China creates new visa for young STEM talent in national tech drive,China creates new visa for young STEM talent in national tech drive ,china creates new visa young stem talent national tech drive
Roblox Retaliates Against Child Abuse Survivor Who Exposed Platform's Predator Problem,Roblox Retaliates Against Child Abuse Survivor Who Exposed Platform's Predator Problem ,roblox retaliates child abuse survivor exposed platforms predator problem
Neil Young Leaves Facebook Over “Unconscionable” Policies for AI Chatbot Conversations With Children,Neil Young Leaves Facebook Over “Unconscionable” Policies for AI Chatbot Conversations With Children ,neil young leaves facebook unconscionable policies ai chatbot conversations children
NHS to use AI technology to help free up hospital beds,NHS to use AI technology to help free up hospital beds ,nhs use ai technology help free hospital beds
"Beauty queens, bogus footage and the battle for truth on the Thailand-Cambodia border","Beauty queens, bogus footage and the battle for truth on the Thailand-Cambodia border ",beauty queens bogus footage battle truth thailandcambodia border
Australian lawyer apologizes for AI-generated errors in murder case -- Defence submissions included fabricated quotes from a speech to the state legislature and nonexistent case citations purportedly from the Supreme Court,Australian lawyer apologizes for AI-generated errors in murder case -- Defence submissions included fabricated quotes from a speech to the state legislature and nonexistent case citations purportedly from the Supreme Court ,australian lawyer apologizes aigenerated errors murder case defence submissions included fabricated quotes speech state legislature nonexistent case citations purportedly supreme court
Hackers Mimic IT Teams to Exploit Microsoft Teams Request to Gain System Remote Access,Hackers Mimic IT Teams to Exploit Microsoft Teams Request to Gain System Remote Access ,hackers mimic teams exploit microsoft teams request gain system remote access
"EU push to protect digital rules holds up trade statement with US, FT reports","EU push to protect digital rules holds up trade statement with US, FT reports ",eu push protect digital rules holds trade statement us ft reports
"Using generative AI, researchers design compounds that can kill drug-resistant bacteria","Using generative AI, researchers design compounds that can kill drug-resistant bacteria ",using generative ai researchers design compounds kill drugresistant bacteria
"Sam Altman says ‘yes,’ AI is in a bubble.","Sam Altman says ‘yes,’ AI is in a bubble. ",sam altman says yes ai bubble
"OAN’s Matt Gaetz apologizes for using AI-generated fakes of women soldiers: ‘The DOD didn’t give us these images; Grok did. And we’ll use better judgment going forward,’ Gaetz admitted on right-wing network","OAN’s Matt Gaetz apologizes for using AI-generated fakes of women soldiers: ‘The DOD didn’t give us these images; Grok did. And we’ll use better judgment going forward,’ Gaetz admitted on right-wing network ",oans matt gaetz apologizes using aigenerated fakes women soldiers dod didnt give us images grok well use better judgment going forward gaetz admitted rightwing network
Meta faces backlash over AI policy that lets bots have ‘sensual’ conversations with children,Meta faces backlash over AI policy that lets bots have ‘sensual’ conversations with children ,meta faces backlash ai policy lets bots sensual conversations children
Microsoft cautions new Windows 11 / 10 ISO installs must have this Defender update,Microsoft cautions new Windows 11 / 10 ISO installs must have this Defender update ,microsoft cautions new windows iso installs must defender update
Millions Told to Delete Emails to Save Drinking Water,Millions Told to Delete Emails to Save Drinking Water ,millions told delete emails save drinking water
Trump mulls a 300% tariff on chips — levies coming within two weeks as Section 232 investigation nears completion,Trump mulls a 300% tariff on chips — levies coming within two weeks as Section 232 investigation nears completion ,trump mulls tariff chips levies coming within two weeks section investigation nears completion
"The Official Voice of the US Government Is Cruel, Gross, and Weird. What Is That Doing to Us?","The Official Voice of the US Government Is Cruel, Gross, and Weird. What Is That Doing to Us? ",official voice us government cruel gross weird us
YouTube Is Making a Play to Host the Oscars,YouTube Is Making a Play to Host the Oscars ,youtube making play host oscars
"Google Gemini will now learn from your chats—unless you tell it not to | Gemini will remember this, so it's time to check your privacy settings.","Google Gemini will now learn from your chats—unless you tell it not to | Gemini will remember this, so it's time to check your privacy settings. ",google gemini learn chatsunless tell gemini remember time check privacy settings
"Apple accidentally leaked its own top secret hardware in software code, revealing new products across seven categories","Apple accidentally leaked its own top secret hardware in software code, revealing new products across seven categories ",apple accidentally leaked top secret hardware software code revealing new products across seven categories
"California Virtual Power Plant Links(VPP) 100,000 Residential Storage Batteries ,One Of The Largest Such Systems In The World","California Virtual Power Plant Links(VPP) 100,000 Residential Storage Batteries ,One Of The Largest Such Systems In The World ",california virtual power plant linksvpp residential storage batteries one largest systems world
"AI is gutting the next generation of talent: In tech, job openings for new grads have already been halved","AI is gutting the next generation of talent: In tech, job openings for new grads have already been halved ",ai gutting next generation talent tech job openings new grads already halved
"Half of Starlink terminals sent to Ukraine found in Russian-occupied areas, US agency says","Half of Starlink terminals sent to Ukraine found in Russian-occupied areas, US agency says ",half starlink terminals sent ukraine found russianoccupied areas us agency says
China-based firm delivers its first chipmaking tool that stamps nanoscale processor designs onto wafers — Prinano's nanoimprint lithography tool uses quartz molds engraved with circuits,China-based firm delivers its first chipmaking tool that stamps nanoscale processor designs onto wafers — Prinano's nanoimprint lithography tool uses quartz molds engraved with circuits ,chinabased firm delivers first chipmaking tool stamps nanoscale processor designs onto wafers prinanos nanoimprint lithography tool uses quartz molds engraved circuits
AI Exacerbates Tech Divide With Smaller Stocks Languishing,AI Exacerbates Tech Divide With Smaller Stocks Languishing ,ai exacerbates tech divide smaller stocks languishing
Sen. Hawley to probe Meta after report finds its AI chatbots flirt with kids | TechCrunch,Sen. Hawley to probe Meta after report finds its AI chatbots flirt with kids | TechCrunch ,sen hawley probe meta report finds ai chatbots flirt kids techcrunch
"This CEO laid off nearly 80% of his staff because they refused to adopt AI fast enough. 2 years later, he says he'd do it again","This CEO laid off nearly 80% of his staff because they refused to adopt AI fast enough. 2 years later, he says he'd do it again ",ceo laid nearly staff refused adopt ai fast enough years later says hed
"AI experts return from China stunned: The U.S. grid is so weak, the race may already be over","AI experts return from China stunned: The U.S. grid is so weak, the race may already be over ",ai experts return china stunned us grid weak race may already
"Asus says 90% of PC and motherboard production has been offshored from China to blunt tariffs — manufacturing moved to Thailand, Vietnam, and Indonesia","Asus says 90% of PC and motherboard production has been offshored from China to blunt tariffs — manufacturing moved to Thailand, Vietnam, and Indonesia ",asus says pc motherboard production offshored china blunt tariffs manufacturing moved thailand vietnam indonesia
Scientists develop interface that ‘reads’ thoughts from speech-impaired patients,Scientists develop interface that ‘reads’ thoughts from speech-impaired patients ,scientists develop interface reads thoughts speechimpaired patients
Watch Figure 02 Humanoid Fold Laundry in New AI Demo,Watch Figure 02 Humanoid Fold Laundry in New AI Demo ,watch figure humanoid fold laundry new ai demo
New CBS Head Honcho Just Blamed YouTube For The Cancellation Of The Late Show,New CBS Head Honcho Just Blamed YouTube For The Cancellation Of The Late Show ,new cbs head honcho blamed youtube cancellation late show
VW introduces monthly subscription to increase car power,VW introduces monthly subscription to increase car power ,vw introduces monthly subscription increase car power
Microsoft launches formal review into alleged use of its Azure cloud in Palestinian surveillance,Microsoft launches formal review into alleged use of its Azure cloud in Palestinian surveillance ,microsoft launches formal review alleged use azure cloud palestinian surveillance
"India focuses on mature-node fab manufacturing to tap automotive, telecom, industrial electronics sectors","India focuses on mature-node fab manufacturing to tap automotive, telecom, industrial electronics sectors ",india focuses maturenode fab manufacturing tap automotive telecom industrial electronics sectors
"Battlefield 6 players' complaints about UI are sinking in as devs promise main menu will be ""constantly tweaked and refined,"" plus bigger maps than the beta will definitely arrive at launch: ""It's not a big problem for us to have our ears to the ground and be very dynamic and open with those things""","Battlefield 6 players' complaints about UI are sinking in as devs promise main menu will be ""constantly tweaked and refined,"" plus bigger maps than the beta will definitely arrive at launch: ""It's not a big problem for us to have our ears to the ground and be very dynamic and open with those things"" ",battlefield players complaints ui sinking devs promise main menu constantly tweaked refined plus bigger maps beta definitely arrive launch big problem us ears ground dynamic open things
Windows 11 on Arm: Microsoft unveils major gaming improvements,Windows 11 on Arm: Microsoft unveils major gaming improvements ,windows arm microsoft unveils major gaming improvements
"Roblox Is Not Doing Enough To Protect Kids, Lawmaker Says","Roblox Is Not Doing Enough To Protect Kids, Lawmaker Says ",roblox enough protect kids lawmaker says
U.S. AI boom is completely upending the electricity market — small businesses and households could foot the bill as industry watchers warn of sharp price increases,U.S. AI boom is completely upending the electricity market — small businesses and households could foot the bill as industry watchers warn of sharp price increases ,us ai boom completely upending electricity market small businesses households could foot bill industry watchers warn sharp price increases
"LibreOffice says Microsoft exploits you via vendor lock-in, offers free ODF migration guide","LibreOffice says Microsoft exploits you via vendor lock-in, offers free ODF migration guide ",libreoffice says microsoft exploits via vendor lockin offers free odf migration guide
Highly anticipated Facebook settlement checks will soon be sent to millions of users,Highly anticipated Facebook settlement checks will soon be sent to millions of users ,highly anticipated facebook settlement checks soon sent millions users
"Russian cyberattack in the Netherlands leaves speed cameras offline indefinitely | Speed limit now ""honor system""","Russian cyberattack in the Netherlands leaves speed cameras offline indefinitely | Speed limit now ""honor system"" ",russian cyberattack netherlands leaves speed cameras offline indefinitely speed limit honor system
What happens when chatbots shape your reality? Concerns are growing online,What happens when chatbots shape your reality? Concerns are growing online ,happens chatbots shape reality concerns growing online
"Is Germany on the Brink of Banning Ad Blockers? User Freedom, Privacy, and Security Is At Risk.","Is Germany on the Brink of Banning Ad Blockers? User Freedom, Privacy, and Security Is At Risk. ",germany brink banning ad blockers user freedom privacy security risk
Tesla Banked $11 Billion By Selling Regulatory Credits. Now The Party's Over.,Tesla Banked $11 Billion By Selling Regulatory Credits. Now The Party's Over. ,tesla banked billion selling regulatory credits partys
"Good News, SCOTUS May Sometimes Still Think The First Amendment Makes Censoring The Internet Illegal, But Good Luck Getting Them To Do Anything About It","Good News, SCOTUS May Sometimes Still Think The First Amendment Makes Censoring The Internet Illegal, But Good Luck Getting Them To Do Anything About It ",good news scotus may sometimes still think first amendment makes censoring internet illegal good luck getting anything
The era of AI hacking has arrived,The era of AI hacking has arrived ,era ai hacking arrived
Class-action suit claims Otter AI secretly records private work conversations,Class-action suit claims Otter AI secretly records private work conversations ,classaction suit claims otter ai secretly records private work conversations
The AI Takeover of Education Is Just Getting Started,The AI Takeover of Education Is Just Getting Started ,ai takeover education getting started
"Forget Netflix, Volkswagen locks horsepower behind paid subscription.
Owners can now subscribe to boost the power of their car… for a fee.","Forget Netflix, Volkswagen locks horsepower behind paid subscription.
Owners can now subscribe to boost the power of their car… for a fee. ",forget netflix volkswagen locks horsepower behind paid subscription owners subscribe boost power car fee
Booking.com customers learn the hard way that Unicode is tricky,Booking.com customers learn the hard way that Unicode is tricky ,bookingcom customers learn hard way unicode tricky
"Meta Told AI to Go Ahead and Be ‘Sensual’ With Kids: Report | Also being racist and giving bad medical information is fine, too.","Meta Told AI to Go Ahead and Be ‘Sensual’ With Kids: Report | Also being racist and giving bad medical information is fine, too. ",meta told ai go ahead sensual kids report also racist giving bad medical information fine
AI could transform how we monitor hurricanes. But experts say it needs work,AI could transform how we monitor hurricanes. But experts say it needs work ,ai could transform monitor hurricanes experts say needs work
Microsoft launches inquiry into claims Israel used its tech for mass surveillance of Palestinians,Microsoft launches inquiry into claims Israel used its tech for mass surveillance of Palestinians ,microsoft launches inquiry claims israel used tech mass surveillance palestinians
"Is Proton leaving Switzerland? ""Legal uncertainty"" of proposed surveillance laws is pushing them to make several changes","Is Proton leaving Switzerland? ""Legal uncertainty"" of proposed surveillance laws is pushing them to make several changes ",proton leaving switzerland legal uncertainty proposed surveillance laws pushing make several changes
US Health Dept Says UnitedHealth Hack Impacted 192.7 Million,US Health Dept Says UnitedHealth Hack Impacted 192.7 Million ,us health dept says unitedhealth hack impacted million
Delivery drones may soon take off in the US. Here’s why,Delivery drones may soon take off in the US. Here’s why ,delivery drones may soon take us heres
Chatbots learned to write from us. Can AI now change the way we think?,Chatbots learned to write from us. Can AI now change the way we think? ,chatbots learned write us ai change way think
Technology and modern warfare: How drones and AI are transforming conflict,Technology and modern warfare: How drones and AI are transforming conflict ,technology modern warfare drones ai transforming conflict
"Starlink tries to block Virginia’s plan to bring fiber Internet to residents | SpaceX wants more money, asks Trump admin to reject state's broadband grant plan.","Starlink tries to block Virginia’s plan to bring fiber Internet to residents | SpaceX wants more money, asks Trump admin to reject state's broadband grant plan. ",starlink tries block virginias plan bring fiber internet residents spacex wants money asks trump admin reject states broadband grant plan
ICE Accidentally Adds Wrong Person to Sensitive Group Chat,ICE Accidentally Adds Wrong Person to Sensitive Group Chat ,ice accidentally adds wrong person sensitive group chat
The Supreme Court lets Mississippi's social media age-verification law go into effect | Justice Kavanaugh denied the request even though the law would likely infringe on First Amendment rights.,The Supreme Court lets Mississippi's social media age-verification law go into effect | Justice Kavanaugh denied the request even though the law would likely infringe on First Amendment rights. ,supreme court lets mississippis social media ageverification law go effect justice kavanaugh denied request even though law would likely infringe first amendment rights
Google AI Overviews linked to 25% drop in publisher referral traffic,Google AI Overviews linked to 25% drop in publisher referral traffic ,google ai overviews linked drop publisher referral traffic
Global EV Sales Jump 27% This Year Despite Anti-Electrification Policies In The US,Global EV Sales Jump 27% This Year Despite Anti-Electrification Policies In The US ,global ev sales jump year despite antielectrification policies us
Meta's flirty AI chatbot invited a retiree to New York. He never made it home,Meta's flirty AI chatbot invited a retiree to New York. He never made it home ,metas flirty ai chatbot invited retiree new york never made home
‘Cheapfake’ AI Celeb Videos Are Rage-Baiting People on YouTube,‘Cheapfake’ AI Celeb Videos Are Rage-Baiting People on YouTube ,cheapfake ai celeb videos ragebaiting people youtube
"Tiny, removable “mini SSD” could eventually be a big deal for gaming handhelds | Fast, removable storage could be one way to address soaring game install sizes.","Tiny, removable “mini SSD” could eventually be a big deal for gaming handhelds | Fast, removable storage could be one way to address soaring game install sizes. ",tiny removable mini ssd could eventually big deal gaming handhelds fast removable storage could one way address soaring game install sizes
Airbnb now lets you ‘pay later’ on vacation rentals,Airbnb now lets you ‘pay later’ on vacation rentals ,airbnb lets pay later vacation rentals
There’s a small problem with Trump’s export deal with Nvidia and AMD: The Constitution says it’s illegal,There’s a small problem with Trump’s export deal with Nvidia and AMD: The Constitution says it’s illegal ,theres small problem trumps export deal nvidia amd constitution says illegal
How a Teen Summer Program Was Swept Up in a $17 Million Heist,How a Teen Summer Program Was Swept Up in a $17 Million Heist ,teen summer program swept million heist
"Trump administration in talks to take Intel stake, reports say","Trump administration in talks to take Intel stake, reports say ",trump administration talks take intel stake reports say
Someone Stuck An RTX 4090 Into A Gaming Handheld,Someone Stuck An RTX 4090 Into A Gaming Handheld ,someone stuck rtx gaming handheld
Afghans resettled in UK hit by new data breach,Afghans resettled in UK hit by new data breach ,afghans resettled uk hit new data breach
"Trump, pharma industry discuss boosting medicine spending abroad to cut US prices, sources say","Trump, pharma industry discuss boosting medicine spending abroad to cut US prices, sources say ",trump pharma industry discuss boosting medicine spending abroad cut us prices sources say
Kodak Says Reports of Its Imminent Demise Are Greatly Exaggerated | The film company say it's not out of the game yet.,Kodak Says Reports of Its Imminent Demise Are Greatly Exaggerated | The film company say it's not out of the game yet. ,kodak says reports imminent demise greatly exaggerated film company say game yet
The First Federal Cybersecurity Disaster of Trump 2.0 Has Arrived,The First Federal Cybersecurity Disaster of Trump 2.0 Has Arrived ,first federal cybersecurity disaster trump arrived
"US government agency drops Grok after MechaHitler backlash, report says | It appears Grok’s antisemitic rants stopped it from becoming feds’ go-to chatbot.","US government agency drops Grok after MechaHitler backlash, report says | It appears Grok’s antisemitic rants stopped it from becoming feds’ go-to chatbot. ",us government agency drops grok mechahitler backlash report says appears groks antisemitic rants stopped becoming feds goto chatbot
BYD reduces fuel consumption of hybrid cars by 10% trough software update,BYD reduces fuel consumption of hybrid cars by 10% trough software update ,byd reduces fuel consumption hybrid cars trough software update
NASA Budget Cuts Could End U.S. Exploration of the Outer Solar System,NASA Budget Cuts Could End U.S. Exploration of the Outer Solar System ,nasa budget cuts could end us exploration outer solar system
Meta appoints anti-LGBTQ+ conspiracy theorist Robby Starbuck as AI bias advisor,Meta appoints anti-LGBTQ+ conspiracy theorist Robby Starbuck as AI bias advisor ,meta appoints antilgbtq conspiracy theorist robby starbuck ai bias advisor
The American Car Industry Can’t Go On Like This,The American Car Industry Can’t Go On Like This ,american car industry cant go like
"ICE Adds Random Person to Group Chat, Exposes Details of Manhunt in Real-Time","ICE Adds Random Person to Group Chat, Exposes Details of Manhunt in Real-Time ",ice adds random person group chat exposes details manhunt realtime
AI’s Impact on Job Growth | J.P. Morgan Global Research,AI’s Impact on Job Growth | J.P. Morgan Global Research ,ais impact job growth jp morgan global research
SF tech CEO offers buyouts to let workers flee 'extreme' work culture,SF tech CEO offers buyouts to let workers flee 'extreme' work culture ,sf tech ceo offers buyouts let workers flee extreme work culture
"Nvidia, AMD Pay A 15% Bribe To The US Treasury To Keep Selling Chips To China","Nvidia, AMD Pay A 15% Bribe To The US Treasury To Keep Selling Chips To China ",nvidia amd pay bribe us treasury keep selling chips china
Tony Robbins Sues Over Unauthorized AI Chatbots,Tony Robbins Sues Over Unauthorized AI Chatbots ,tony robbins sues unauthorized ai chatbots
Ford’s ‘Model T moment’ couldn’t come at a worse time,Ford’s ‘Model T moment’ couldn’t come at a worse time ,fords model moment couldnt come worse time
Inside the CIA-backed venture fund that helped launch Palantir and Google Earth,Inside the CIA-backed venture fund that helped launch Palantir and Google Earth ,inside ciabacked venture fund helped launch palantir google earth
"Can’t pay, won’t pay: impoverished streaming services are driving viewers back to piracy","Can’t pay, won’t pay: impoverished streaming services are driving viewers back to piracy ",cant pay wont pay impoverished streaming services driving viewers back piracy
Google and Roblox Defeat Videogame Addiction Lawsuit-Courtright v. Epic Games,Google and Roblox Defeat Videogame Addiction Lawsuit-Courtright v. Epic Games ,google roblox defeat videogame addiction lawsuitcourtright v epic games
"The end of laptops at work? Desktop as a service is now cheaper and easier to run, reports claim","The end of laptops at work? Desktop as a service is now cheaper and easier to run, reports claim ",end laptops work desktop service cheaper easier run reports claim
"Louisiana sues Roblox, alleging child exploitation and safety failures","Louisiana sues Roblox, alleging child exploitation and safety failures ",louisiana sues roblox alleging child exploitation safety failures
Trump Administration Is Said to Discuss US Taking Stake in Intel,Trump Administration Is Said to Discuss US Taking Stake in Intel ,trump administration said discuss us taking stake intel
IT Departments Are Overloaded With Busy Work. Can AI Change That?,IT Departments Are Overloaded With Busy Work. Can AI Change That? ,departments overloaded busy work ai change
IT Departments Are Overloaded With Busy Work. Can AI Change That?,IT Departments Are Overloaded With Busy Work. Can AI Change That? ,departments overloaded busy work ai change
Internet Group Challenges Constitutionality of Minor Web Use Law,Internet Group Challenges Constitutionality of Minor Web Use Law ,internet group challenges constitutionality minor web use law
Therapeutic vaccine for chronic hepatitis B enters first clinical trial in patients,Therapeutic vaccine for chronic hepatitis B enters first clinical trial in patients ,therapeutic vaccine chronic hepatitis b enters first clinical trial patients
China’s Lead in Open-Source AI Jolts Washington and Silicon Valley,China’s Lead in Open-Source AI Jolts Washington and Silicon Valley ,chinas lead opensource ai jolts washington silicon valley
India reaches 100 GW of solar module manufacturing capacity,India reaches 100 GW of solar module manufacturing capacity ,india reaches gw solar module manufacturing capacity
"New report suggests that there are 3 million fewer PC gamers in Japan than 10 years ago, despite the market having at least tripled in size","New report suggests that there are 3 million fewer PC gamers in Japan than 10 years ago, despite the market having at least tripled in size ",new report suggests million fewer pc gamers japan years ago despite market least tripled size
