title,text,clean_text
"Russia Is Pumping Out Disinformation That Looks Like Legitimate News Reports | Despite Donald Trump's whining about ""fake news,"" his administration has rolled back efforts to combat it, allowing fakes to flourish","Russia Is Pumping Out Disinformation That Looks Like Legitimate News Reports | Despite Donald Trump's whining about ""fake news,"" his administration has rolled back efforts to combat it, allowing fakes to flourish ",russia pumping disinformation looks like legitimate news reports despite donald trumps whining fake news administration rolled back efforts combat allowing fakes flourish
SpaceX Gets Billions From the Government. It Gives Little to Nothing Back in Taxes.,SpaceX Gets Billions From the Government. It Gives Little to Nothing Back in Taxes. ,spacex gets billions government gives little nothing back taxes
"US Energy Secretary Calls For An End To All Subsidies For Solar & Wind | “End all subsidies for renewables, Energy Secretary Wright says. We say, “Why stop there? Get rid of all energy subsidies,","US Energy Secretary Calls For An End To All Subsidies For Solar & Wind | “End all subsidies for renewables, Energy Secretary Wright says. We say, “Why stop there? Get rid of all energy subsidies, ",us energy secretary calls end subsidies solar wind end subsidies renewables energy secretary wright says say stop get rid energy subsidies
"Report: Microsoft's latest Windows 11 24H2 update breaks SSDs/HDDs, may corrupt your data","Report: Microsoft's latest Windows 11 24H2 update breaks SSDs/HDDs, may corrupt your data ",report microsofts latest windows h update breaks ssdshdds may corrupt data
"Versant to rename MSNBC, drop famed peacock logos in Comcast separation","Versant to rename MSNBC, drop famed peacock logos in Comcast separation ",versant rename msnbc drop famed peacock logos comcast separation
"Net Neutrality Advocates Won’t Appeal Trump Destruction, Say U.S. Courts Are Broken","Net Neutrality Advocates Won’t Appeal Trump Destruction, Say U.S. Courts Are Broken ",net neutrality advocates wont appeal trump destruction say us courts broken
He Sold His Likeness. Now His Avatar Is Shilling Supplements on TikTok.,He Sold His Likeness. Now His Avatar Is Shilling Supplements on TikTok. ,sold likeness avatar shilling supplements tiktok
"4K Blu-Ray of 22-Year-Old 'Master and Commander' Is Sold Out Everywhere, Being Scalped on eBay | The cult classic 2005 film is selling for double the MSRP on the secondary market.","4K Blu-Ray of 22-Year-Old 'Master and Commander' Is Sold Out Everywhere, Being Scalped on eBay | The cult classic 2005 film is selling for double the MSRP on the secondary market. ",k bluray yearold master commander sold everywhere scalped ebay cult classic film selling double msrp secondary market
"AI could widen the wealth gap and wipe out entry-level jobs, expert says","AI could widen the wealth gap and wipe out entry-level jobs, expert says ",ai could widen wealth gap wipe entrylevel jobs expert says
"Judge blocks FTC probe into Media Matters, calls it government ""retaliation"" that should alarm Americans | FTC probe blocked in escalating X dispute","Judge blocks FTC probe into Media Matters, calls it government ""retaliation"" that should alarm Americans | FTC probe blocked in escalating X dispute ",judge blocks ftc probe media matters calls government retaliation alarm americans ftc probe blocked escalating x dispute
"White House spreadsheet rates 553 companies and trade associations on loyalty to ‘One Big Beautiful Bill’ -- Uber, DoorDash, United, Delta, AT&T, and Cisco are ‘examples of good partners’","White House spreadsheet rates 553 companies and trade associations on loyalty to ‘One Big Beautiful Bill’ -- Uber, DoorDash, United, Delta, AT&T, and Cisco are ‘examples of good partners’ ",white house spreadsheet rates companies trade associations loyalty one big beautiful bill uber doordash united delta att cisco examples good partners
Nearly a million patients hit by DaVita dialysis ransomware attack,Nearly a million patients hit by DaVita dialysis ransomware attack ,nearly million patients hit davita dialysis ransomware attack
"On his 75th birthday, Apple legend Steve Wozniak pops up in a comment thread about his 'bad decision' to sell his stock in the '80s with a devastatingly zen reply: 'I gave all my Apple wealth away because wealth and power are not what I live for'","On his 75th birthday, Apple legend Steve Wozniak pops up in a comment thread about his 'bad decision' to sell his stock in the '80s with a devastatingly zen reply: 'I gave all my Apple wealth away because wealth and power are not what I live for' ",th birthday apple legend steve wozniak pops comment thread bad decision sell stock devastatingly zen reply gave apple wealth away wealth power live
"A brazen attack on air safety is underway — here’s what’s at stake | Instead of fixing air safety regulations, the Trump administration is undermining them.","A brazen attack on air safety is underway — here’s what’s at stake | Instead of fixing air safety regulations, the Trump administration is undermining them. ",brazen attack air safety underway heres whats stake instead fixing air safety regulations trump administration undermining
Duolingo CEO says controversial AI memo was misunderstood,Duolingo CEO says controversial AI memo was misunderstood ,duolingo ceo says controversial ai memo misunderstood
"Intel engineer who stole documents for Microsoft job fined $34,000 but avoids prison | The engineer is leaving the technology industry to pursue a new career in vineyard management","Intel engineer who stole documents for Microsoft job fined $34,000 but avoids prison | The engineer is leaving the technology industry to pursue a new career in vineyard management ",intel engineer stole documents microsoft job fined avoids prison engineer leaving technology industry pursue new career vineyard management
FBI issues warning to all smartphone users — a dangerous new scam could be at your door,FBI issues warning to all smartphone users — a dangerous new scam could be at your door ,fbi issues warning smartphone users dangerous new scam could door
Health insurers are using AI to auto-deny claims now free AI tools are being built to auto-appeal them,Health insurers are using AI to auto-deny claims now free AI tools are being built to auto-appeal them ,health insurers using ai autodeny claims free ai tools built autoappeal
"Hackers unleash torrent from Norwegian dam, releasing 132 gallons per second for four hours | Norway links dam sabotage to pro-Russian hackers","Hackers unleash torrent from Norwegian dam, releasing 132 gallons per second for four hours | Norway links dam sabotage to pro-Russian hackers ",hackers unleash torrent norwegian dam releasing gallons per second four hours norway links dam sabotage prorussian hackers
YouTube Launched an AI Tool to Guess Your Age—and Restrict Your Account If It Thinks You’re a Child,YouTube Launched an AI Tool to Guess Your Age—and Restrict Your Account If It Thinks You’re a Child ,youtube launched ai tool guess ageand restrict account thinks youre child
"BlackBerry Classic is being revived with Android, and it can be yours for $400","BlackBerry Classic is being revived with Android, and it can be yours for $400 ",blackberry classic revived android
How Australia’s teen social media ban tech trial was derailed by expert turmoil and secrecy,How Australia’s teen social media ban tech trial was derailed by expert turmoil and secrecy ,australias teen social media ban tech trial derailed expert turmoil secrecy
"Ofcom £20,000 fine of Delaware-incorporated 4chan is illegal says US law firm","Ofcom £20,000 fine of Delaware-incorporated 4chan is illegal says US law firm ",ofcom fine delawareincorporated chan illegal says us law firm
NextDNS rolls out new feature to bypass age verification checks on adult websites,NextDNS rolls out new feature to bypass age verification checks on adult websites ,nextdns rolls new feature bypass age verification checks adult websites
'Dark side of AI': How teen girl allegedly faked threats from 2 boys — and cops bought it,'Dark side of AI': How teen girl allegedly faked threats from 2 boys — and cops bought it ,dark side ai teen girl allegedly faked threats boys cops bought
How China Went From Clean Energy Copycat to Global Innovator. A surge in high quality research and patent applications has cemented China’s dominance in the industry.,How China Went From Clean Energy Copycat to Global Innovator. A surge in high quality research and patent applications has cemented China’s dominance in the industry. ,china went clean energy copycat global innovator surge high quality research patent applications cemented chinas dominance industry
Meta Gave Its AI the Green Light to Be ‘Sensual’ With Kids,Meta Gave Its AI the Green Light to Be ‘Sensual’ With Kids ,meta gave ai green light sensual kids
Scientists capture first footage of human embryo implanting in a uterus | Groundbreaking footage shows ‘surprisingly invasive’ process and may help to improve infertility treatments,Scientists capture first footage of human embryo implanting in a uterus | Groundbreaking footage shows ‘surprisingly invasive’ process and may help to improve infertility treatments ,scientists capture first footage human embryo implanting uterus groundbreaking footage shows surprisingly invasive process may help improve infertility treatments
Uber Users Cancel Rides With Human Drivers to Ride in Waymo Taxis,Uber Users Cancel Rides With Human Drivers to Ride in Waymo Taxis ,uber users cancel rides human drivers ride waymo taxis
"Steam's new Performance Overlay is more accurate than Task Manager, says Valve — GPU utilization monitoring comes directly to Steam in latest client beta","Steam's new Performance Overlay is more accurate than Task Manager, says Valve — GPU utilization monitoring comes directly to Steam in latest client beta ",steams new performance overlay accurate task manager says valve gpu utilization monitoring comes directly steam latest client beta
Nvidia says H20 export controls didn’t stop China’s AI progress — claims 'they only stifled U.S. economic and technology leadership',Nvidia says H20 export controls didn’t stop China’s AI progress — claims 'they only stifled U.S. economic and technology leadership' ,nvidia says h export controls didnt stop chinas ai progress claims stifled us economic technology leadership
"Before You Pump Gas, Look For These Signs Of A Card Skimmer","Before You Pump Gas, Look For These Signs Of A Card Skimmer ",pump gas look signs card skimmer
From VPN Spikes to Censored Forums: The Unintended Fallout of the UK’s Online Safety Act,From VPN Spikes to Censored Forums: The Unintended Fallout of the UK’s Online Safety Act ,vpn spikes censored forums unintended fallout uks online safety act
"Actor Terence Stamp, who played General Zod in Superman and Mankar Camoran in The Elder Scrolls 4: Oblivion, has died | Stamp was 87 years old.","Actor Terence Stamp, who played General Zod in Superman and Mankar Camoran in The Elder Scrolls 4: Oblivion, has died | Stamp was 87 years old. ",actor terence stamp played general zod superman mankar camoran elder scrolls oblivion died stamp years old
Louisiana AG Calls Out ‘Escape to Epstein Island’ Roblox Game in Lawsuit | The lawsuit alleges that Roblox is prioritizing profits over child safety.,Louisiana AG Calls Out ‘Escape to Epstein Island’ Roblox Game in Lawsuit | The lawsuit alleges that Roblox is prioritizing profits over child safety. ,louisiana ag calls escape epstein island roblox game lawsuit lawsuit alleges roblox prioritizing profits child safety
"In sudden shift, American emissions rise as China’s falls","In sudden shift, American emissions rise as China’s falls ",sudden shift american emissions rise chinas falls
New Gmail Phishing Attack With Weaponized Login Flow Steals Credentials,New Gmail Phishing Attack With Weaponized Login Flow Steals Credentials ,new gmail phishing attack weaponized login flow steals credentials
Japan's 1st osmotic power plant begins operating in Fukuoka,Japan's 1st osmotic power plant begins operating in Fukuoka ,japans st osmotic power plant begins operating fukuoka
"As People Ridicule GPT-5, Sam Altman Says OpenAI Will Need ‘Trillions’ in Infrastructure","As People Ridicule GPT-5, Sam Altman Says OpenAI Will Need ‘Trillions’ in Infrastructure ",people ridicule gpt sam altman says openai need trillions infrastructure
"Ex-Intel engineer Varun Gupta sentenced and fined $34,472 for stealing trade secrets and sharing with Microsoft; Judge says: Used those materials during ... - The Times of India","Ex-Intel engineer Varun Gupta sentenced and fined $34,472 for stealing trade secrets and sharing with Microsoft; Judge says: Used those materials during ... - The Times of India ",exintel engineer varun gupta sentenced fined stealing trade secrets sharing microsoft judge says used materials times india
U.S. Senator Hawley launches probe into Meta AI policies,U.S. Senator Hawley launches probe into Meta AI policies ,us senator hawley launches probe meta ai policies
FAA Insider Opens Up About Drone Incursions Over Military Bases,FAA Insider Opens Up About Drone Incursions Over Military Bases ,faa insider opens drone incursions military bases
AI in education's potential privacy nightmare,AI in education's potential privacy nightmare ,ai educations potential privacy nightmare
Caltech researchers use sound to extend quantum data storage 30x longer,Caltech researchers use sound to extend quantum data storage 30x longer ,caltech researchers use sound extend quantum data storage x longer
RushTok backlash: Why sororities aren't letting prospects post,RushTok backlash: Why sororities aren't letting prospects post ,rushtok backlash sororities arent letting prospects post
How the US army is using influencers to recruit a new generation: ‘Promise them this idea of stability’,How the US army is using influencers to recruit a new generation: ‘Promise them this idea of stability’ ,us army using influencers recruit new generation promise idea stability
The CD turns 43: The format that changed music forever | The influence of the compact disc still resonates,The CD turns 43: The format that changed music forever | The influence of the compact disc still resonates ,cd turns format changed music forever influence compact disc still resonates
Apple CEO Tim Cook Says the Technology They’re Developing Will Be ‘One of the Most Profound Technologies of Our Lifetime’,Apple CEO Tim Cook Says the Technology They’re Developing Will Be ‘One of the Most Profound Technologies of Our Lifetime’ ,apple ceo tim cook says technology theyre developing one profound technologies lifetime
Sound Waves Unlock a New Path to Practical Quantum Computing,Sound Waves Unlock a New Path to Practical Quantum Computing ,sound waves unlock new path practical quantum computing
"Large Language Models, Small Labor Market Effects.","Large Language Models, Small Labor Market Effects. ",large language models small labor market effects
World Humanoid Robot Games debut in Beijing with Unitree leading the field,World Humanoid Robot Games debut in Beijing with Unitree leading the field ,world humanoid robot games debut beijing unitree leading field
China gets Intel Xeon 6P Granite Rapids CPUs repackaged with added security and surveillance features — Jintide C6P CPUs with up to 86 P-cores,China gets Intel Xeon 6P Granite Rapids CPUs repackaged with added security and surveillance features — Jintide C6P CPUs with up to 86 P-cores ,china gets intel xeon p granite rapids cpus repackaged added security surveillance features jintide cp cpus pcores
"Big Tech’s A.I. Data Centers Are Driving Up Electricity Bills for Everyone | Electricity rates for individuals and small businesses could rise sharply as Amazon, Google, Microsoft and other technology companies build data centers and expand into the energy business","Big Tech’s A.I. Data Centers Are Driving Up Electricity Bills for Everyone | Electricity rates for individuals and small businesses could rise sharply as Amazon, Google, Microsoft and other technology companies build data centers and expand into the energy business ",big techs ai data centers driving electricity bills everyone electricity rates individuals small businesses could rise sharply amazon google microsoft technology companies build data centers expand energy business
Base iPhone 18 to launch by Spring 2027 instead of Fall 2026,Base iPhone 18 to launch by Spring 2027 instead of Fall 2026 ,base iphone launch spring instead fall
"Meta spends more guarding Mark Zuckerberg than Apple, Nvidia, Microsoft, Amazon, and Alphabet do for their own CEOs—combined","Meta spends more guarding Mark Zuckerberg than Apple, Nvidia, Microsoft, Amazon, and Alphabet do for their own CEOs—combined ",meta spends guarding mark zuckerberg apple nvidia microsoft amazon alphabet ceoscombined
"4,000 Meters: Ukrainian Sniper Sets New World-Record Kill Using AI and Drones.","4,000 Meters: Ukrainian Sniper Sets New World-Record Kill Using AI and Drones. ",meters ukrainian sniper sets new worldrecord kill using ai drones
"Polestar sets production car record for longest drive on a single charge | 581 miles on a single charge is impressive, but haven't other drives gone farther?","Polestar sets production car record for longest drive on a single charge | 581 miles on a single charge is impressive, but haven't other drives gone farther? ",polestar sets production car record longest drive single charge miles single charge impressive havent drives gone farther
Chinese company unveils floating technology that could generate energy on the surface of the ocean — here's what you need to know,Chinese company unveils floating technology that could generate energy on the surface of the ocean — here's what you need to know ,chinese company unveils floating technology could generate energy surface ocean heres need know
Washington's hydropower has created a data center boom. Some are concerned about its future.,Washington's hydropower has created a data center boom. Some are concerned about its future. ,washingtons hydropower created data center boom concerned future
Hands-on: We ran full desktop Linux apps on an Android phone,Hands-on: We ran full desktop Linux apps on an Android phone ,handson ran full desktop linux apps android phone
Who controls the food supply? Proposed changes to seed reuse reopens debate,Who controls the food supply? Proposed changes to seed reuse reopens debate ,controls food supply proposed changes seed reuse reopens debate
AI Eroded Doctors’ Ability to Spot Cancer Within Months in Study,AI Eroded Doctors’ Ability to Spot Cancer Within Months in Study ,ai eroded doctors ability spot cancer within months study
Nabiha Syed remakes Mozilla Foundation in the era of Trump and AI,Nabiha Syed remakes Mozilla Foundation in the era of Trump and AI ,nabiha syed remakes mozilla foundation era trump ai
"Steam founder Gabe Newell is investing his $9.5 billion fortune in his new passion, big ass boats, because he's ""a hands-on visionary who respects the sea"": ""Welcome to Oceanco's next journey""","Steam founder Gabe Newell is investing his $9.5 billion fortune in his new passion, big ass boats, because he's ""a hands-on visionary who respects the sea"": ""Welcome to Oceanco's next journey"" ",steam founder gabe newell investing billion fortune new passion big ass boats hes handson visionary respects sea welcome oceancos next journey
CobraJet Nvidia AI-powered drone killer takes out 'overwhelming enemy drone incursions' at up to 300mph,CobraJet Nvidia AI-powered drone killer takes out 'overwhelming enemy drone incursions' at up to 300mph ,cobrajet nvidia aipowered drone killer takes overwhelming enemy drone incursions mph
Meta under fire over AI rules that allow romantic roleplay with children and false medical advice,Meta under fire over AI rules that allow romantic roleplay with children and false medical advice ,meta fire ai rules allow romantic roleplay children false medical advice
Anthropic's Claude AI now has the ability to end 'distressing' conversations,Anthropic's Claude AI now has the ability to end 'distressing' conversations ,anthropics claude ai ability end distressing conversations
Senator Josh Hawley Begins Child Safety Inquiry Into Meta’s A.I. Bot,Senator Josh Hawley Begins Child Safety Inquiry Into Meta’s A.I. Bot ,senator josh hawley begins child safety inquiry metas ai bot
"NASA’s acting chief calls for the end of Earth science at the space agency | NASA's charter clearly states the agency should study planet Earth, however.","NASA’s acting chief calls for the end of Earth science at the space agency | NASA's charter clearly states the agency should study planet Earth, however. ",nasas acting chief calls end earth science space agency nasas charter clearly states agency study planet earth however
"Neil Young Ending All Facebook & Instagram Promotion Over ""Meta's Use Of Chatbots With Children""","Neil Young Ending All Facebook & Instagram Promotion Over ""Meta's Use Of Chatbots With Children"" ",neil young ending facebook instagram promotion metas use chatbots children
Can Dynamic Line Rating Solve Grid Congestion?,Can Dynamic Line Rating Solve Grid Congestion? ,dynamic line rating solve grid congestion
"Oracle Layoffs Hit Employees With OCI, Media Services, Sovereign Cloud","Oracle Layoffs Hit Employees With OCI, Media Services, Sovereign Cloud ",oracle layoffs hit employees oci media services sovereign cloud
OpenAI's Sam Altman sees AI bubble forming as industry spending surges,OpenAI's Sam Altman sees AI bubble forming as industry spending surges ,openais sam altman sees ai bubble forming industry spending surges
"We've Heard Of 'Deepfake', But What Is 'Cheapfake'?","We've Heard Of 'Deepfake', But What Is 'Cheapfake'? ",weve heard deepfake cheapfake
A Linux alternative? Debian/Hurd shows microkernel Unix dream is alive,A Linux alternative? Debian/Hurd shows microkernel Unix dream is alive ,linux alternative debianhurd shows microkernel unix dream alive
Pentagon Funded Experiment Develops Robots that Change by ‘Consuming’ Other Robots | Researchers say this 'robot metabolism' is an early step in giving AI biological style bodies.,Pentagon Funded Experiment Develops Robots that Change by ‘Consuming’ Other Robots | Researchers say this 'robot metabolism' is an early step in giving AI biological style bodies. ,pentagon funded experiment develops robots change consuming robots researchers say robot metabolism early step giving ai biological style bodies
Mark Zuckerberg's vision for humanity is terrifying,Mark Zuckerberg's vision for humanity is terrifying ,mark zuckerbergs vision humanity terrifying
"Robots race, play football, crash and collapse at China’s ‘robot Olympics’","Robots race, play football, crash and collapse at China’s ‘robot Olympics’ ",robots race play football crash collapse chinas robot olympics
"AI Agents Make Up a Third of All Search Traffic Toward Brands, Report Says","AI Agents Make Up a Third of All Search Traffic Toward Brands, Report Says ",ai agents make third search traffic toward brands report says
Sam Altman says investors are acting irrational in a booming AI bubble,Sam Altman says investors are acting irrational in a booming AI bubble ,sam altman says investors acting irrational booming ai bubble
Scientists Identify a New Glitch in Human Thinking,Scientists Identify a New Glitch in Human Thinking ,scientists identify new glitch human thinking
AI-powered stuffed animals are coming for your kids,AI-powered stuffed animals are coming for your kids ,aipowered stuffed animals coming kids
Normal Computing tapes-out world’s first thermodynamic chip for energy efficient AI workloads,Normal Computing tapes-out world’s first thermodynamic chip for energy efficient AI workloads ,normal computing tapesout worlds first thermodynamic chip energy efficient ai workloads
Anthropic says some Claude models can now end ‘harmful or abusive’ conversations,Anthropic says some Claude models can now end ‘harmful or abusive’ conversations ,anthropic says claude models end harmful abusive conversations
China's biotech boom leaves U.S. playing catch-up,China's biotech boom leaves U.S. playing catch-up ,chinas biotech boom leaves us playing catchup
Samsung taking market share from Apple in U.S. as foldable phones gain momentum,Samsung taking market share from Apple in U.S. as foldable phones gain momentum ,samsung taking market share apple us foldable phones gain momentum
"AI has created a new breed of cat video: addictive, disturbing and nauseatingly quick soap operas","AI has created a new breed of cat video: addictive, disturbing and nauseatingly quick soap operas ",ai created new breed cat video addictive disturbing nauseatingly quick soap operas
How your solar rooftop became a national security issue,How your solar rooftop became a national security issue ,solar rooftop became national security issue
Even Volkswagen Is Doing Horsepower Subscriptions Now,Even Volkswagen Is Doing Horsepower Subscriptions Now ,even volkswagen horsepower subscriptions
German court revives case that could threaten ad blockers,German court revives case that could threaten ad blockers ,german court revives case could threaten ad blockers
Shark AI uses fossil shark teeth to get middle school kids interested in paleontology and computer vision,Shark AI uses fossil shark teeth to get middle school kids interested in paleontology and computer vision ,shark ai uses fossil shark teeth get middle school kids interested paleontology computer vision
