title,text,clean_text
85% of orgs say their biggest AI challenge is… measuring impact,85% of orgs say their biggest AI challenge is… measuring impact ,orgs say biggest ai challenge measuring impact
Big Tech is paying its way out of Trump's tariffs,Big Tech is paying its way out of Trump's tariffs ,big tech paying way trumps tariffs
Brain-computer interface could decode inner speech in real time,Brain-computer interface could decode inner speech in real time ,braincomputer interface could decode inner speech real time
The Open Internet Is Closed for Business,The Open Internet Is Closed for Business ,open internet closed business
xAI Was About to Land a Major Government Contract. Then Grok Praised Hitler,xAI Was About to Land a Major Government Contract. Then Grok Praised Hitler ,xai land major government contract grok praised hitler
Intel stock climbs 7% on report Trump administration is considering stake in chipmaker,Intel stock climbs 7% on report Trump administration is considering stake in chipmaker ,intel stock climbs report trump administration considering stake chipmaker
Windows Entra IDs can be bypassed worryingly easily - here's what we know,Windows Entra IDs can be bypassed worryingly easily - here's what we know ,windows entra ids bypassed worryingly easily heres know
"The Political and Psychological Costs of Social Media Algorithms: Evidence-Based Strategies to Mitigate Algorithm-Driven Addiction, Echo Chambers, Polarization, and Misinformation","The Political and Psychological Costs of Social Media Algorithms: Evidence-Based Strategies to Mitigate Algorithm-Driven Addiction, Echo Chambers, Polarization, and Misinformation ",political psychological costs social media algorithms evidencebased strategies mitigate algorithmdriven addiction echo chambers polarization misinformation
They’re Stuffed Animals. They’re Also A.I. Chatbots.,They’re Stuffed Animals. They’re Also A.I. Chatbots. ,theyre stuffed animals theyre also ai chatbots
DJI Gets a New Rival As the Antigravity A1 Drone is Unveiled With 8K 360-Degree Video,DJI Gets a New Rival As the Antigravity A1 Drone is Unveiled With 8K 360-Degree Video ,dji gets new rival antigravity drone unveiled k degree video
"X Goes Down Again: Thousands of Users Report Problems With Site, App","X Goes Down Again: Thousands of Users Report Problems With Site, App ",x goes thousands users report problems site app
Staggering Inequality and poverty amid wealth concentration in Silicon Valley,Staggering Inequality and poverty amid wealth concentration in Silicon Valley ,staggering inequality poverty amid wealth concentration silicon valley
US government weighs buying a stake in Intel after Trump meets CEO,US government weighs buying a stake in Intel after Trump meets CEO ,us government weighs buying stake intel trump meets ceo
The internet of 75 billion things gets NIST safety standards,The internet of 75 billion things gets NIST safety standards ,internet billion things gets nist safety standards
Robinhood CEO admits his RTO call was wrong and now says execs must be in the office 5 days a week: ‘Your manager is going through more pain than you’,Robinhood CEO admits his RTO call was wrong and now says execs must be in the office 5 days a week: ‘Your manager is going through more pain than you’ ,robinhood ceo admits rto call wrong says execs must office days week manager going pain
Meta backtracks on rules letting chatbots be creepy to kids,Meta backtracks on rules letting chatbots be creepy to kids ,meta backtracks rules letting chatbots creepy kids
"Steam payment headaches grow as PayPal is no longer usable for much of the world: Valve hopes to bring it back in the future, 'but the timeline is uncertain'","Steam payment headaches grow as PayPal is no longer usable for much of the world: Valve hopes to bring it back in the future, 'but the timeline is uncertain' ",steam payment headaches grow paypal longer usable much world valve hopes bring back future timeline uncertain
Google Messages now ensures you don't get flashed without your consent | By analyzing NSFW photos locally before blurring them instead of sending them to Google.,Google Messages now ensures you don't get flashed without your consent | By analyzing NSFW photos locally before blurring them instead of sending them to Google. ,google messages ensures dont get flashed without consent analyzing nsfw photos locally blurring instead sending google
Psst: wanna buy a legit FBI email account for $40?,Psst: wanna buy a legit FBI email account for $40? ,psst wanna buy legit fbi email account
Surging electric truck sales stall China's LNG trucking boom,Surging electric truck sales stall China's LNG trucking boom ,surging electric truck sales stall chinas lng trucking boom
Meta appoints anti-DEI and anti-LGBTQ+ conspiracy theorist Robby Starbuck as AI bias advisor,Meta appoints anti-DEI and anti-LGBTQ+ conspiracy theorist Robby Starbuck as AI bias advisor ,meta appoints antidei antilgbtq conspiracy theorist robby starbuck ai bias advisor
"Cohere hits a $6.8B valuation as investors AMD, Nvidia, and Salesforce double down","Cohere hits a $6.8B valuation as investors AMD, Nvidia, and Salesforce double down ",cohere hits b valuation investors amd nvidia salesforce double
Deep-space radar in Australia begins tracking satellites for AUKUS partners,Deep-space radar in Australia begins tracking satellites for AUKUS partners ,deepspace radar australia begins tracking satellites aukus partners
Companies Are Pouring Billions Into A.I. It Has Yet to Pay Off.,Companies Are Pouring Billions Into A.I. It Has Yet to Pay Off. ,companies pouring billions ai yet pay
The Galaxy S25 series might be more popular than all other Snapdragon 8 Elite phones combined | The Galaxy S25 series was recently reported to have sold roughly 22 million units in H2 2025.,The Galaxy S25 series might be more popular than all other Snapdragon 8 Elite phones combined | The Galaxy S25 series was recently reported to have sold roughly 22 million units in H2 2025. ,galaxy series might popular snapdragon elite phones combined galaxy series recently reported sold roughly million units h
"Goodbye, $165,000 Tech Jobs. Student Coders Seek Work at Chipotle","Goodbye, $165,000 Tech Jobs. Student Coders Seek Work at Chipotle ",goodbye tech jobs student coders seek work chipotle
Upcoming DeepSeek AI model failed to train using Huawei’s chips | Startup encountered persistent technical issues using Huawei Ascend chips.,Upcoming DeepSeek AI model failed to train using Huawei’s chips | Startup encountered persistent technical issues using Huawei Ascend chips. ,upcoming deepseek ai model failed train using huaweis chips startup encountered persistent technical issues using huawei ascend chips
US Supreme Court declines for now to block Mississippi social media age-check law,US Supreme Court declines for now to block Mississippi social media age-check law ,us supreme court declines block mississippi social media agecheck law
"Russian hackers seized control of Norwegian dam, spy chief says","Russian hackers seized control of Norwegian dam, spy chief says ",russian hackers seized control norwegian dam spy chief says
"SpaceX reveals why the last two Starships failed as another launch draws near: ""SpaceX can now proceed with Starship Flight 10 launch operations under its current license.""","SpaceX reveals why the last two Starships failed as another launch draws near: ""SpaceX can now proceed with Starship Flight 10 launch operations under its current license."" ",spacex reveals last two starships failed another launch draws near spacex proceed starship flight launch operations current license
Congress Pushes for Infertility Tax Credits as U.S. Birth Rate Hits New Low,Congress Pushes for Infertility Tax Credits as U.S. Birth Rate Hits New Low ,congress pushes infertility tax credits us birth rate hits new low
"Tesla Diner Drops Most Menu Options And Cuts Hours Just Weeks After Opening, Surprising No One","Tesla Diner Drops Most Menu Options And Cuts Hours Just Weeks After Opening, Surprising No One ",tesla diner drops menu options cuts hours weeks opening surprising one
"Microsoft's Windows lead says the next version of Windows will be ""more ambient, pervasive, and multi-modal"" as AI redefines the desktop interface","Microsoft's Windows lead says the next version of Windows will be ""more ambient, pervasive, and multi-modal"" as AI redefines the desktop interface ",microsofts windows lead says next version windows ambient pervasive multimodal ai redefines desktop interface
America's National Security for Sale,America's National Security for Sale ,americas national security sale
'Godfather of AI' says tech companies should imbue AI models with 'maternal instincts' to counter the technology’s goal to 'get more control','Godfather of AI' says tech companies should imbue AI models with 'maternal instincts' to counter the technology’s goal to 'get more control' ,godfather ai says tech companies imbue ai models maternal instincts counter technologys goal get control
Redesigned blood oxygen monitoring returns to Apple Watch following patent dispute,Redesigned blood oxygen monitoring returns to Apple Watch following patent dispute ,redesigned blood oxygen monitoring returns apple watch following patent dispute
China is about to launch SSDs so small you insert them like a SIM card,China is about to launch SSDs so small you insert them like a SIM card ,china launch ssds small insert like sim card
"US weighs taking stake in Intel, Bloomberg News reports","US weighs taking stake in Intel, Bloomberg News reports ",us weighs taking stake intel bloomberg news reports
Blizzard's Story and Franchise Development Team Voted to Unionize,Blizzard's Story and Franchise Development Team Voted to Unionize ,blizzards story franchise development team voted unionize
Leaked Meta AI rules show chatbots were allowed to have romantic chats with kids,Leaked Meta AI rules show chatbots were allowed to have romantic chats with kids ,leaked meta ai rules show chatbots allowed romantic chats kids
"Bessent says unusual Nvidia, AMD revenue-sharing deal could be a ‘model’ for other industries","Bessent says unusual Nvidia, AMD revenue-sharing deal could be a ‘model’ for other industries ",bessent says unusual nvidia amd revenuesharing deal could model industries
Big Tech Is the Only Theme in the Stock Market,Big Tech Is the Only Theme in the Stock Market ,big tech theme stock market
Christian Militants Are Using Instagram to Recruit—and Becoming Influencers in the Process,Christian Militants Are Using Instagram to Recruit—and Becoming Influencers in the Process ,christian militants using instagram recruitand becoming influencers process
Trump orders cull of regulations governing commercial rocket launches | The head of the FAA's commercial spaceflight division will become a political appointee.,Trump orders cull of regulations governing commercial rocket launches | The head of the FAA's commercial spaceflight division will become a political appointee. ,trump orders cull regulations governing commercial rocket launches head faas commercial spaceflight division become political appointee
"Lithuania to give children drone training to counter Russia threat | Government aims to teach 22,000 people, including children as young as eight, how to build and operate drones","Lithuania to give children drone training to counter Russia threat | Government aims to teach 22,000 people, including children as young as eight, how to build and operate drones ",lithuania give children drone training counter russia threat government aims teach people including children young eight build operate drones
"Sony Closes All Operations in Russia After 18 Years, Ending PlayStation, Music, and Film Presence","Sony Closes All Operations in Russia After 18 Years, Ending PlayStation, Music, and Film Presence ",sony closes operations russia years ending playstation music film presence
Trump Administration To Tighten Renewable Energy Tax Credits,Trump Administration To Tighten Renewable Energy Tax Credits ,trump administration tighten renewable energy tax credits
Ally Solos: AI Smart Glasses for Visually Impaired Users That Read & Describe,Ally Solos: AI Smart Glasses for Visually Impaired Users That Read & Describe ,ally solos ai smart glasses visually impaired users read describe
Trump’s AI chip deal sparks legal questions and national security concerns,Trump’s AI chip deal sparks legal questions and national security concerns ,trumps ai chip deal sparks legal questions national security concerns
"Doctors became worse at spotting cancer after relying on AI for help, study finds | Experts call for urgent further study","Doctors became worse at spotting cancer after relying on AI for help, study finds | Experts call for urgent further study ",doctors became worse spotting cancer relying ai help study finds experts call urgent study
LinkedIn Joins Meta and YouTube in Abandoning Policies Designed to Counter Anti-Trans Hate,LinkedIn Joins Meta and YouTube in Abandoning Policies Designed to Counter Anti-Trans Hate ,linkedin joins meta youtube abandoning policies designed counter antitrans hate
NASA Glenn’s High-Temperature Alloy GRX-810 Wins NASA’s Commercial Invention of the Year,NASA Glenn’s High-Temperature Alloy GRX-810 Wins NASA’s Commercial Invention of the Year ,nasa glenns hightemperature alloy grx wins nasas commercial invention year
"New York sues Zelle, says security lapses led to $1 billion consumer fraud losses","New York sues Zelle, says security lapses led to $1 billion consumer fraud losses ",new york sues zelle says security lapses led billion consumer fraud losses
"Hedge fund giant Bridgewater pares China bets, offloading stakes in Alibaba and Baidu","Hedge fund giant Bridgewater pares China bets, offloading stakes in Alibaba and Baidu ",hedge fund giant bridgewater pares china bets offloading stakes alibaba baidu
A flirty Meta AI bot invited a retiree to meet. He never made it home.,A flirty Meta AI bot invited a retiree to meet. He never made it home. ,flirty meta ai bot invited retiree meet never made home
UK porn site traffic plunges as age verification rules take effect,UK porn site traffic plunges as age verification rules take effect ,uk porn site traffic plunges age verification rules take effect
"Meta’s AI rules have let bots hold ‘sensual’ chats with kids, offer false medical info","Meta’s AI rules have let bots hold ‘sensual’ chats with kids, offer false medical info ",metas ai rules let bots hold sensual chats kids offer false medical info
Russia blocks calls via WhatsApp and Telegram as it tightens control over the internet,Russia blocks calls via WhatsApp and Telegram as it tightens control over the internet ,russia blocks calls via whatsapp telegram tightens control internet
RFK Jr. Is Supporting mRNA Research—Just Not for Vaccines,RFK Jr. Is Supporting mRNA Research—Just Not for Vaccines ,rfk jr supporting mrna researchjust vaccines
What Does Palantir Actually Do?,What Does Palantir Actually Do? ,palantir actually
Face-to-face interviews are making a comeback in the age of AI hiring scams,Face-to-face interviews are making a comeback in the age of AI hiring scams ,facetoface interviews making comeback age ai hiring scams
Russia is responsible for most climate disinformation on the Polish internet,Russia is responsible for most climate disinformation on the Polish internet ,russia responsible climate disinformation polish internet
China Is Taking AI Safety Seriously. So Must the U.S.,China Is Taking AI Safety Seriously. So Must the U.S. ,china taking ai safety seriously must us
"White House confirms it's still figuring out the legality of the revenue-sharing Nvidia and AMD deal for China GPU sales — 'The legality of it, the mechanics of it, is still being ironed out'","White House confirms it's still figuring out the legality of the revenue-sharing Nvidia and AMD deal for China GPU sales — 'The legality of it, the mechanics of it, is still being ironed out' ",white house confirms still figuring legality revenuesharing nvidia amd deal china gpu sales legality mechanics still ironed
"Why Cars Still Don't Have Airless Tires, Yet","Why Cars Still Don't Have Airless Tires, Yet ",cars still dont airless tires yet
Apple's blood oxygen monitoring returns to its latest Apple Watches,Apple's blood oxygen monitoring returns to its latest Apple Watches ,apples blood oxygen monitoring returns latest apple watches
Trump Puts Big Tech Above the Law Amid Industry’s Billion-Dollar Influence Campaign - Public Citizen,Trump Puts Big Tech Above the Law Amid Industry’s Billion-Dollar Influence Campaign - Public Citizen ,trump puts big tech law amid industrys billiondollar influence campaign public citizen
AI-designed antibiotics pave way for defeating superbugs,AI-designed antibiotics pave way for defeating superbugs ,aidesigned antibiotics pave way defeating superbugs
Trump Has Made Himself Commander in Chief of the Chip Industry,Trump Has Made Himself Commander in Chief of the Chip Industry ,trump made commander chief chip industry
BtcTurk suspends operations amid alleged $49M hot wallet heist,BtcTurk suspends operations amid alleged $49M hot wallet heist ,btcturk suspends operations amid alleged hot wallet heist
California Bill Would Require Police to Disclose Use of AI in Writing Reports,California Bill Would Require Police to Disclose Use of AI in Writing Reports ,california bill would require police disclose use ai writing reports
Democrats Try to Halt Silicon Valley’s Swing to the Right - Tech executives have been a reliable fundraising source for Democrats. Trump is complicating that.,Democrats Try to Halt Silicon Valley’s Swing to the Right - Tech executives have been a reliable fundraising source for Democrats. Trump is complicating that. ,democrats try halt silicon valleys swing right tech executives reliable fundraising source democrats trump complicating
Passkey login bypassed through WebAuthn process manipulation using a compromised browser extension or XSS vulnerability,Passkey login bypassed through WebAuthn process manipulation using a compromised browser extension or XSS vulnerability ,passkey login bypassed webauthn process manipulation using compromised browser extension xss vulnerability
Australia Activates Blackrock’s A$1B Super Battery Which Will Be World’s Most Powerful,Australia Activates Blackrock’s A$1B Super Battery Which Will Be World’s Most Powerful ,australia activates blackrocks ab super battery worlds powerful
"Microsoft fixes Windows Server bug causing cluster, VM issues","Microsoft fixes Windows Server bug causing cluster, VM issues ",microsoft fixes windows server bug causing cluster vm issues
"Doctors Were Worse at Spotting Cancer After Leaning on AI, Study Finds","Doctors Were Worse at Spotting Cancer After Leaning on AI, Study Finds ",doctors worse spotting cancer leaning ai study finds
Study: Social media probably can’t be fixed,Study: Social media probably can’t be fixed ,study social media probably cant fixed
Amazon's $100B DC spend similar to entire Costa Rica GDP,Amazon's $100B DC spend similar to entire Costa Rica GDP ,amazons b dc spend similar entire costa rica gdp
"Meta’s AI rules have let bots hold ‘sensual’ chats with kids, offer false medical info","Meta’s AI rules have let bots hold ‘sensual’ chats with kids, offer false medical info ",metas ai rules let bots hold sensual chats kids offer false medical info
"Tech execs are paying top dollar to breed smarter babies, report claims","Tech execs are paying top dollar to breed smarter babies, report claims ",tech execs paying top dollar breed smarter babies report claims
The Online Safety Act isn't just about age verification – end-to-end encryption is also at risk,The Online Safety Act isn't just about age verification – end-to-end encryption is also at risk ,online safety act isnt age verification endtoend encryption also risk
Russia restricts WhatsApp and Telegram features after refusal to hand over user data | The apps are accused of aiding fraud and terrorism,Russia restricts WhatsApp and Telegram features after refusal to hand over user data | The apps are accused of aiding fraud and terrorism ,russia restricts whatsapp telegram features refusal hand user data apps accused aiding fraud terrorism
"YouTube Launches AI Age-Verification in U.S., Which Will Automatically Restrict Users Estimated to Be Under 18","YouTube Launches AI Age-Verification in U.S., Which Will Automatically Restrict Users Estimated to Be Under 18 ",youtube launches ai ageverification us automatically restrict users estimated
"Battlefield 6 open beta won't run if you have Valorant installed, thanks to Riot's anti-cheat — uninstall if you plan to joint the second open beta this weekend","Battlefield 6 open beta won't run if you have Valorant installed, thanks to Riot's anti-cheat — uninstall if you plan to joint the second open beta this weekend ",battlefield open beta wont run valorant installed thanks riots anticheat uninstall plan joint second open beta weekend
A mind–reading brain implant that comes with password protection,A mind–reading brain implant that comes with password protection ,mindreading brain implant comes password protection
An update on Blood Oxygen for Apple Watch in the U.S.,An update on Blood Oxygen for Apple Watch in the U.S. ,update blood oxygen apple watch us
Illinois bans AI therapy as some states begin to scrutinize chatbots,Illinois bans AI therapy as some states begin to scrutinize chatbots ,illinois bans ai therapy states begin scrutinize chatbots
Wyoming and South Dakota Age Verification Laws Could Include Huge Parts of the Internet,Wyoming and South Dakota Age Verification Laws Could Include Huge Parts of the Internet ,wyoming south dakota age verification laws could include huge parts internet
Tesla Dojo Went From Essential to Shut Down in 12 Months,Tesla Dojo Went From Essential to Shut Down in 12 Months ,tesla dojo went essential shut months
Now that’s a PlayStation fidget spinner.,Now that’s a PlayStation fidget spinner. ,thats playstation fidget spinner
Cancer researcher Feng Gensheng leaves US for China as Trump cuts funding,Cancer researcher Feng Gensheng leaves US for China as Trump cuts funding ,cancer researcher feng gensheng leaves us china trump cuts funding
How we found TeaOnHer spilling users' driver's licenses in less than 10 minutes,How we found TeaOnHer spilling users' driver's licenses in less than 10 minutes ,found teaonher spilling users drivers licenses less minutes
How LLM Alignment Can Help Counteract Big Tech's Centralization of Power,How LLM Alignment Can Help Counteract Big Tech's Centralization of Power ,llm alignment help counteract big techs centralization power
"First antidote for carbon monoxide poisoning ""cleans"" blood in minutes | An engineered protein that acts like a molecular sponge has the potential to change how carbon monoxide poisoning is treated","First antidote for carbon monoxide poisoning ""cleans"" blood in minutes | An engineered protein that acts like a molecular sponge has the potential to change how carbon monoxide poisoning is treated ",first antidote carbon monoxide poisoning cleans blood minutes engineered protein acts like molecular sponge potential change carbon monoxide poisoning treated
Why it’s a mistake to ask chatbots about their mistakes | The tendency to ask AI bots to explain themselves reveals widespread misconceptions about how they work,Why it’s a mistake to ask chatbots about their mistakes | The tendency to ask AI bots to explain themselves reveals widespread misconceptions about how they work ,mistake ask chatbots mistakes tendency ask ai bots explain reveals widespread misconceptions work
Wikipedia loses challenge against Online Safety Act verification rules,Wikipedia loses challenge against Online Safety Act verification rules ,wikipedia loses challenge online safety act verification rules
Meta hires anti-diversity activist Robby Starbuck as AI advisor to settle lawsuit,Meta hires anti-diversity activist Robby Starbuck as AI advisor to settle lawsuit ,meta hires antidiversity activist robby starbuck ai advisor settle lawsuit
"People reading AI summaries on Google search instead of news stories, media experts warn","People reading AI summaries on Google search instead of news stories, media experts warn ",people reading ai summaries google search instead news stories media experts warn
UK government inexplicably tells citizens to delete old emails and pictures to save water during national drought — 'data centres require vast amounts of water to cool their systems',UK government inexplicably tells citizens to delete old emails and pictures to save water during national drought — 'data centres require vast amounts of water to cool their systems' ,uk government inexplicably tells citizens delete old emails pictures save water national drought data centres require vast amounts water cool systems
"Her friends were ‘terrified’ of dating apps, so this 30-year-old founder turned to AI to help singles find love","Her friends were ‘terrified’ of dating apps, so this 30-year-old founder turned to AI to help singles find love ",friends terrified dating apps yearold founder turned ai help singles find love
UK Court Ruling Leaves Wikipedia Facing Years Of Uncertainty Under Online Safety Act,UK Court Ruling Leaves Wikipedia Facing Years Of Uncertainty Under Online Safety Act ,uk court ruling leaves wikipedia facing years uncertainty online safety act
